Apartment Name,Short Description,Rooms and Bathrooms,Price per Night,Host Name,Account Active Since,Guest favourite stars,Guest favourite reviews
Modern 3 BR Home with Entertaining Kitchen & Patio,"Entire home in Whittier, California, United States",6 guests ·  · 3 bedrooms ·  · 3 beds ·  · 2 baths,€ 228 ,Hosted by Tiffany,2 years hosting,4.94,18
@ Marbella Lane - Captivating Home w/Pool,"Entire home in Rowland Heights, California, United States",8 guests ·  · 4 bedrooms ·  · 4 beds ·  · 3 baths,€ 286 ,Hosted by Wendy,7 years hosting,Not guest favourite,Not guest favourite
❤️ Serene 4/3 Venice Canals Getaway w/ FASTEST Wifi,"Entire home in Los Angeles, California, United States",7 guests ·  · 3 bedrooms ·  · 4 beds ·  · 3 baths,€ 585 ,Hosted by Trevor,11 years hosting,4.91,82
Cahuenga Park by AvantStay | Hollywood Hills Home,"Entire home in Los Angeles, California, United States",6 guests ·  · 3 bedrooms ·  · 3 beds ·  · 3 baths,€ 267 ,Hosted by AvantStay, · 2 years hosting,Not guest favourite,Not guest favourite
Upscale Home in Central Irvine-Pool+Gym+BBQ,"Entire rental unit in Irvine, California, United States",8 guests ·  · 2 bedrooms ·  · 6 beds ·  · 2 baths,€ 168 ,Hosted by Kevin, · 9 years hosting,Not guest favourite,Not guest favourite
Marina Del Rey's Best Kept Secret,"Entire home in Los Angeles, California, United States",6 guests ·  · 3 bedrooms ·  · 3 beds ·  · 3 baths,€ 370 ,Hosted by Ari, · 7 years hosting,Not guest favourite,Not guest favourite
Cozy 1BD1BA Apt Pool Gym & 2 Free Parking,"Entire rental unit in Marina del Rey, California, United States",4 guests ·  · 1 bedroom ·  · 2 beds ·  · 1 bath,€ 202 ,Hosted by Cozy Homes,3 years hosting,Not guest favourite,Not guest favourite
Jie’s choice 3b single house with large backyard²,"Entire home in Arcadia, California, United States",6 guests ·  · 3 bedrooms ·  · 3 beds ·  · 2 baths,€ 176 ,Hosted by Chaoqi,1 year hosting,Not guest favourite,Not guest favourite
Cheerful Cozy 1 bed/1 bath private entrance unit C,"Entire guesthouse in Baldwin Park, California, United States",3 guests ·  · 1 bedroom ·  · 1 bed ·  · 1 bath,€ 83 ,Hosted by Sophy, · 2 years hosting,4.90,29
Topanga Nest in the Canyon,"Entire rental unit in Topanga, California, United States",2 guests ·  · 1 bedroom ·  · 1 bed ·  · 1 bath,€ 162 ,Hosted by Julie, · 2 years hosting,4.97,32
2-Story Cozy Home Private Unit B,"Entire townhouse in El Monte, California, United States",3 guests ·  · Studio ·  · 2 beds ·  · 1 bath,€ 116 ,Hosted by Nan, · 2 years hosting,4.93,28
California Midcentury Modern Vibe,"Entire home in Glendale, California, United States",4 guests ·  · 2 bedrooms ·  · 2 beds ·  · 1 bath,€ 221 ,Hosted by Alina, · 1 year hosting,Not guest favourite,Not guest favourite
-Waterfront Marina Views Resort Style Amenities,"Entire condo in Marina del Rey, California, United States",4 guests ·  · 2 bedrooms ·  · 2 beds ·  · 2.5 baths,€ 402 ,Hosted by Peter, · 2 years hosting,Not guest favourite,Not guest favourite
8 miles to DTLA. Private Bedroom&Bath. Private Den,"Room in Monterey Park, California, United States",1 queen bed ·  · Dedicated bathroom,€ 51 ,Stay with Scarlet, · 8 years hosting,5.0,40
Walk Of Fame Luxury Oasis,"Entire rental unit in West Hollywood, California, United States",6 guests ·  · 2 bedrooms ·  · 4 beds ·  · 2 baths,€ 279 ,Hosted by Ham Rentals, · 2 years hosting,Not guest favourite,Not guest favourite
Cozy Vibes-Condo in Central OC W/ Free Parking-W/D,"Entire rental unit in Santa Ana, California, United States",5 guests ·  · 1 bedroom ·  · 2 beds ·  · 1 bath,€ 123 ,Hosted by Kevin, · 9 years hosting,Not guest favourite,Not guest favourite
Charming Vintage Style Home,"Entire home in La Puente, California, United States",6 guests ·  · 2 bedrooms ·  · 3 beds ·  · 2 baths,€ 148 ,Hosted by Raymond,5 years hosting,Not guest favourite,Not guest favourite
"Big & Comfortable Private Getaway, Near Disneyland","Entire rental unit in Garden Grove, California, United States",8 guests ·  · 2 bedrooms ·  · 3 beds ·  · 2 baths,€ 132 ,Hosted by Kaveeka,9 years hosting,Not guest favourite,Not guest favourite
Topanga Nest in the Canyon,"Entire rental unit in Topanga, California, United States",2 guests ·  · 1 bedroom ·  · 1 bed ·  · 1 bath,€ 162 ,Hosted by Julie, · 2 years hosting,4.97,32
2-Story Cozy Home Private Unit B,"Entire townhouse in El Monte, California, United States",3 guests ·  · Studio ·  · 2 beds ·  · 1 bath,€ 116 ,Hosted by Nan, · 2 years hosting,4.93,28
"Poolside Bliss: 1BD with Gym, 2 Free Parking","Entire rental unit in Marina del Rey, California, United States",2 guests ·  · 1 bedroom ·  · 1 bed ·  · 1 bath,€ 188 ,Hosted by Cozy Homes,3 years hosting,4.92,13
Jie’s Choice - Ultimate peace 3b3b prime Arcadia,"Entire home in Arcadia, California, United States",6 guests ·  · 3 bedrooms ·  · 3 baths,€ 220 ,Hosted by Jie, · 3 years hosting,Not guest favourite,Not guest favourite
"Private Bathroom,  Self check in & out","Entire home in Monrovia, California, United States",2 guests ·  · 1 bedroom ·  · 1 bed ·  · 1 bath,€ 47 ,Hosted by Laura,4 years hosting,Not guest favourite,Not guest favourite
New renovated nice neighborhood  free parking,"Entire home in San Gabriel,, California, United States",10 guests ·  · 4 bedrooms ·  · 4 beds ·  · 2 baths,€ 186 ,Hosted by Austin, · 7 years hosting,Not guest favourite,Not guest favourite
Mid-Century House in LA (C),"Entire home in San Gabriel, California, United States",3 guests ·  · 1 bedroom ·  · 1 bed ·  · 1 bath,€ 98 ,Hosted by Mandy, · 7 years hosting,Not guest favourite,Not guest favourite
Cozy Apartment | 2 min DTSA | 92 Wlkscr | A/C,"Entire rental unit in Santa Ana, California, United States",4 guests ·  · 1 bedroom ·  · 1 bath,€ 123 ,Hosted by Ruben, · 3 years hosting,Not guest favourite,Not guest favourite
New Gated Townhouse 3 BRs/3.5 Baths Free Parking,"Entire townhouse in Pico Rivera, California, United States",6 guests ·  · 3 bedrooms ·  · 3 beds ·  · 3.5 baths,€ 177 ,Hosted by Julia, · 1 year hosting,5.0,9
Beautiful master bedroom in Melrose and Hollywood,"Room in Los Angeles, California, United States",1 bed ·  · Shared bathroom,€ 57 ,Hosted by Oleksandr,2 years hosting,Not guest favourite,Not guest favourite
Spacious Shadow Hills Home with Pool/BBQ/Hot tub,"Entire home in Los Angeles, California, United States",10 guests ·  · 3 bedrooms ·  · 3 beds ·  · 3 baths,€ 307 ,Hosted by Gianna, · 1 year hosting,Not guest favourite,Not guest favourite
2Bdroom 1Bath house full kitchen,"Entire home in Simi Valley, California, United States",4 guests ·  · 2 bedrooms ·  · 2 beds ·  · 1 bath,€ 167 ,Hosted by Sheridan,3 years hosting,Not guest favourite,Not guest favourite
"Pool, Hottub, Disney, Knott's, 1/1, Wi-fi, Parking","Entire rental unit in Stanton, California, United States",5 guests ·  · 1 bedroom ·  · 3 beds ·  · 1 bath,€ 130 ,Hosted by Maria, · 5 years hosting,Not guest favourite,Not guest favourite
"Private and luxurious room, private bathroom, large bed of Cali King, fully furnished, free parking, intimate community, high-speed internet access!","Room in Alhambra, California, United States",1 king bed ·  · Private attached bathroom,€ 64 ,Stay with Chen, · 2 years hosting,Not guest favourite,Not guest favourite
The Penmar Retreat - Luxurious resort-style oasis,"Entire home in Los Angeles, California, United States",10 guests ·  · 4 bedrooms ·  · 5 beds ·  · 5.5 baths,€ 883 ,Hosted by Justin At VerveExecutiveStays, · 2 years hosting,5.0,16
Fabulous NoHo Home,"Entire home in Los Angeles, California, United States",8 guests ·  · 3 bedrooms ·  · 4 beds ·  · 2 baths,€ 384 ,Hosted by Roni, · 6 years hosting,4.97,35
Topanga Bliss: Timeless Villa with Endless Views,"Entire home in Topanga, California, United States",7 guests ·  · 3 bedrooms ·  · 3 baths,€ 294 ,Hosted by Jessica,13 years hosting,Not guest favourite,Not guest favourite
Business Trip King Bed HD RokuTV Relaxing Balcony,"Entire home in Santa Ana, California, United States",5 guests ·  · 1 bedroom ·  · 1 bath,€ 102 ,Hosted by Miski Elena, · 4 years hosting,Not guest favourite,Not guest favourite
